<?xml version="1.0" encoding="UTF-8"?>
<users xmlns:xsi="http://www.w3.org/2001/XMLSchema-instance" xsi:noNamespaceSchemaLocation="dataScheme.xsd">
  <user>
    <Id>1</Id>
    <Name>ahmed</Name>
    <Email>a@gmail.com</Email>
    <Password>12345678</Password>
    <Role>Admin</Role>
  </user>
  <user>
    <Id>2</Id>
    <Name>mohamed</Name>
    <Email>n@gmail.com</Email>
    <Password>12345678</Password>
    <Role>Teacher</Role>
    <Classes>
      <class>PD</class>
      <class>OS</class>
      <class>AI</class>
    </Classes>
  </user>
  <user>
    <Id>3</Id>
    <Name>mahmoud</Name>
    <Email>m@gmail.com</Email>
    <Password>12345678</Password>
    <Role>Teacher</Role>
    <Classes>
      <class>PD</class>
      <class>OS</class>
      <class>AI</class>
    </Classes>
  </user>
  <user>
    <Id>4</Id>
    <Name>ahmed</Name>
    <Email>b@gmail.com</Email>
    <Password>12345678</Password>
    <Role>Student</Role>
    <Attendance>
      <Record>
        <Date>2024-02-02</Date>
        <Status>absent</Status>
      </Record>
    </Attendance>
    <SClass>PD</SClass>
  </user>
  <user>
    <Id>5</Id>
    <Name>ahmed</Name>
    <Email>c@gmail.com</Email>
    <Password>12345678</Password>
    <Role>Student</Role>
    <Attendance>
      <Record>
        <Date>2024-02-02</Date>
        <Status>absent</Status>
      </Record>
    </Attendance>
    <SClass>PD</SClass>
  </user>
  <user>
    <Id>6</Id>
    <Name>ahmed</Name>
    <Email>d@gmail.com</Email>
    <Password>12345678</Password>
    <Role>Student</Role>
    <Attendance>
      <Record>
        <Date>2024-02-02</Date>
        <Status>absent</Status>
      </Record>
    </Attendance>
    <SClass>PD</SClass>
  </user>
  <user>
    <Id>7</Id>
    <Name>ahmed</Name>
    <Email>e@gmail.com</Email>
    <Password>12345678</Password>
    <Role>Student</Role>
    <Attendance>
      <Record>
        <Date>2024-02-02</Date>
        <Status>absent</Status>
      </Record>
    </Attendance>
    <SClass>PD</SClass>
  </user>
  <user>
    <Id>8</Id>
    <Name>ahmed</Name>
    <Email>f@gmail.com</Email>
    <Password>12345678</Password>
    <Role>Student</Role>
    <Attendance>
      <Record>
        <Date>2024-02-02</Date>
        <Status>absent</Status>
      </Record>
    </Attendance>
    <SClass>PD</SClass>
  </user>
  <user>
    <Id>9</Id>
    <Name>ahmed</Name>
    <Email>g@gmail.com</Email>
    <Password>12345678</Password>
    <Role>Student</Role>
    <Attendance>
      <Record>
        <Date>2024-02-02</Date>
        <Status>absent</Status>
      </Record>
    </Attendance>
    <SClass>PD</SClass>
  </user>
  <user>
    <Id>10</Id>
    <Name>ahmed</Name>
    <Email>h@gmail.com</Email>
    <Password>12345678</Password>
    <Role>Student</Role>
    <Attendance>
      <Record>
        <Date>2024-02-02</Date>
        <Status>absent</Status>
      </Record>
    </Attendance>
    <SClass>PD</SClass>
  </user>
  <user>
    <Id>11</Id>
    <Name>ahmed</Name>
    <Email>i@gmail.com</Email>
    <Password>12345678</Password>
    <Role>Student</Role>
    <Attendance>
      <Record>
        <Date>2024-02-02</Date>
        <Status>absent</Status>
      </Record>
    </Attendance>
    <SClass>PD</SClass>
  </user>
  <user>
    <Id>12</Id>
    <Name>ahmed</Name>
    <Email>j@gmail.com</Email>
    <Password>12345678</Password>
    <Role>Student</Role>
    <Attendance>
      <Record>
        <Date>2024-02-02</Date>
        <Status>present</Status>
      </Record>
      <Record>
        <Date>2024-02-03</Date>
        <Status>present</Status>
      </Record>
    </Attendance>
    <SClass>PD</SClass>
  </user>
  <user>
    <Id>12</Id>
    <Name>ahmed</Name>
    <Email>j@gmail.com</Email>
    <Password>12345678</Password>
    <Role>Student</Role>
    <Attendance>
      <Record>
        <Date>2024-02-03</Date>
        <Status>present</Status>
      </Record>
    </Attendance>
    <SClass>PD</SClass>
  </user>
  <user>
    <Id>db0ee21c-dc55-47f9-9546-30bf0a0453a2</Id>
    <Name>addTeacher</Name>
    <Email>test@add.com</Email>
    <Password>1233456</Password>
    <Role>Teacher</Role>
    <Classes>
      <class>OS</class>
      <class>PD</class>
    </Classes>
  </user>
  <user>
    <Id>e88fa615-bb6c-4973-b34b-e6c63f059c80</Id>
    <Name>newTeacher</Name>
    <Email>add@teacher.com</Email>
    <Password>12345678</Password>
    <Role>Teacher</Role>
    <Classes>
      <class>AI</class>
    </Classes>
  </user>
  <user>
    <Id>774392e3-f582-4499-94a5-9fd26aec1685</Id>
    <Name>addStudent</Name>
    <Email>add@student.com</Email>
    <Password>s123568</Password>
    <Role>Student</Role>
    <SClass>OS</SClass>
  </user>
</users>